image_url,text
https://github.com/aubreymoore/insects-of-guam-datamining/raw/master/b172/curculionidae-of-guam/merged_images/Viticis guamae.jpg,"1. Viticis guamae, new species (pl. 1, B).<br>Derrn black, dulled by coarse reticulation, tarsi diluted with red, antennae amber<br>colored {scales moderately dense, somewhat irregularly condensed on some areas, especially<br>at base of pronotum and on sides of clytra ncar base and beyond middle, the scales oval,<br>convex, solid, with a pearly luster,<br>H cad with crown ﬁnely punctate, setae ﬁne, prostrate near top, becoming broader and<br>more squamiform toward eyes<br> front broadly, shallowly, slightly or distinctly concave<br>between eyes, the concavity extending well above level of tops of eyes in middle<br> eyes<br>slightly longer than shortest distance between them, separated from prothorax by a dis-<br>tance about equal to two thirds of their length. Rostrum straightly expanded on sides,<br>sub A-shaped from base to apex, but with the epistome projecting and making middle<br>two thirds of the otherwise truncate apex strongly convex, as broad across broadest apical<br>part as length plus one half length of an eye<br> squamose on either side of front to antennae,<br>thence coarsely reticulate and with scattered punctures, densely squamose on sides along<br>fore margins of scrobes. Antennae with scape as long as funicle excluding club<br> ﬁrst<br>funicular segment about as broad as long, as long as 2 plus 3, 2 hardly longer than 3, 4<br>to 6 successively slightly broader<br> club but slightly longer than broad, as long as the<br>preceding ﬁve funicular segments. I’v‘othorax four ﬁfths as long as broad, apex slightly<br>convex, base concave on either side of middle, but slightly arcuate on sides from base to<br>apex, distance across base one ﬁfth broader than that of apex<br> coarsely and densely punc-<br>L’ite throughout<br> longitudinal dorsal contour evenly and slightly areuatc. Elytm two thirds<br>as broad as long, three times as long as the prothorax<br> longitudinal dorsal outline rising<br>evenly from base to reach summit at or slightly behind middle<br> broadest at apical third,<br>Head about as long from pronotuni to front of eyes as basal breadth, with a distinct,<br>narrow constriction four ﬁfths the length of an eye behind eyes as measured from above.<br>constriction not impressed across dorsurn<br> area behind constriction shiny, impunctatc, area<br>beyond constriction and interocular area rather coarsely, densely, snbconﬂuently punctatc,<br>interstices narrower than punctures<br> interocular area not quite four times as broad as<br>breadth of an eye as measured from above, with a. shallow, obscure median fovea between<br>hind margins of eyes<br> eyes very slightly more convex than sides of head, ﬁve sevenths<br>as long as high, Rostrum forming a continuous curve with front of head, three ﬁfths as<br>long from front of eyes to apex as length of prothorast, three times as long as an eye,<br>almost twice as long as its basal breadth, subparallel»sided from base to apex but outline<br>made slightly sinuous by a slight expansion at antennae, apex distinctly emarginatc in<br>middle<br> antennae inserted at basal third at a length of an eye from eyes<br> scrobes extend—<br>ing to middle, their upper margins ill deﬁned, but evidently directed to lower margin of<br>eyes, lower edges of scrobes well marked, terminating below about middle of eyes and<br>there the breadth of apex of scape from eyes<br> with a ﬁne groove running from top of<br>scrobe above antenna] insertion<br> puncturation dense, continuous with that of front, becom-<br>ing distinctly ﬁner distally. Antennae with scape extending behind eye to cephalic con—<br>striction<br> ﬁrst funicular segment hardly longer than broad, as long as 2 plus 3, 2 sub:<br>quadratc, 3 to 7 successively slightly more transverse<br> club as long as preceding ﬁve<br>segments, Prothanw slightly longer than broad (2.7:2.5), base and apex subtruncate,<br>broadest at basal third, thence arcuately narrowing to narrow subapical constriction, con.<br>striction evidently not interrupting almost straight longitudinal dorsal outline<br> densely<br>and evenly punctured throughout, punctures medium large, separated by less than their<br>diameters, without any impunctate areas<br> setae minute, hardly discernible. Elytm some—<br>what more than twice as long as broad, somewhat more than twice as long and slightly<br>broader than prothorax, very slightly and gradually narrowed to apical third, thence<br>more rapidly narrowed, thence broadly rounded at apex<br> striac distinct and well impressed,<br>tenth complete, punctures crenulating sides of intervals, about as broad as intervals on<br>disk, closely placed<br> intervals convex, each bearing a row of minute punctures giving<br>rise to microscopical setac, 7 beginning above metacoxa, 9 costiform from above third<br>ventritc to its apex joining 1 at apex. Leys with femoral setae minute<br> tibiae strongly<br>uncinate and mucronate, a mucro about half as long as inner edge of an uncus<br> third hind<br>tarsal segment entire, slightly broader than 2, slightly broader than long, third fore<br>tarsal segment about twice as broad as 2. 5 [427141011 with prosternum densely, conipara~<br>tively coarsely punctate, interstices narrower than punctures, broadly depressed down<br>middle, more than twice as long in front of than behind coxae (ll : 4), intercoxal process<br>ﬁve sevenths as broad as a coxa<br> mesosternum densely punctatc, on same plane as meta-<br>sternum, intercoxal process as broad as .1 coxa<br> nietasternum broadly depressed down<br>middle, coarsely and densely punctate throughout except between metacoxae, interstices<br>narrower than punctures, twice as long between mid and hind coxac as intercoxal process<br>of mesosternum, metacoxae as widely separated as mesocoxae. Vent” with ﬁrst ventrite<br>broadly concave down middle, ventrites l and 2 less densely and coarsely punctate than<br>metasternum<br> ventritcs 3 and 4 with a basal row of coarse punctures and a row of small<br>discal punctures<br> vontrite 5 densely set with small punctures. Length, 22 mm<br><br>breadth, 065 mm."
https://github.com/aubreymoore/insects-of-guam-datamining/raw/master/b172/curculionidae-of-guam/merged_images/Menectetorus tutuilae.jpg,"Menectetorus tutuilae (Marshall),'new combination.<br>Chaetectetorus mtwilae Marshall, Insects of Samoa 4(5) : 296, ﬁg. 15, 1931.<br>Samoa."
https://github.com/aubreymoore/insects-of-guam-datamining/raw/master/b172/curculionidae-of-guam/merged_images/Cosmo polites sordidus.jpg,"46. Cosmopolites sordidus (Germar) (pl. 6, G).<br>Calandm sqrdida Germar, Ins. Spec. Nov,, 299, 1824.<br>Sphenaphorus slrialm‘ Fahraeus, in Schoenherr's Gen, Spec. Curc. 8(2) :<br>251, 1845.<br>Sphenophorus cribr'icallis Walker, Ann. Mag. Nat. Hist. III, 4: 218, 1859.<br>This tropicopolitan pest of bananas is represented in the collection by<br>numerous specimens taken at Dededo, Yona, Yigo, Mt. Alifan, and Barrigada<br>from bananas in May, June, Aug. and Nov., by Swezey and Usinger."
https://github.com/aubreymoore/insects-of-guam-datamining/raw/master/b172/curculionidae-of-guam/merged_images/Trigonops inusitata.jpg,"2. Trigonops inusitata, new species (pl. 1, F )1<br>Derm very dark brown to black<br> rostrum with brown scales, often with a greenish or<br>bronzy cast at base, those on apical declivitous part usually mostly greenish<br> head with<br>brown scales with bronze and green scales intermixed<br> prouotum with pale, almost white<br>scales, with fawn—colored and darker brown scales interspersed, lateral scaling palest,<br>most scales with a bronzy cast<br> elytra predominantly with dark brown bronzy scaling,<br>usually with a conspicuous, almost white, broadly V»shaped fascia across middle, but this<br>fascia subject to great variation, often absent or indistinct<br> legs with paler sealing beyond<br>middle of. club of femora than proximally, tibiae with similarly colored, rather dark brown<br>bronzy scales as on bases of femora<br> scaling below similar to that on sides of elytra.<br>Head with round, rather deep punctures on front, punctures usually not separated by<br>more than their diameters, and variable, usually somewhat obscured by the scaling, each<br>puncture bearing a white, recnrved seta which does not reach much beyond the margin of<br>its puncture, scales close, not imbricated<br> eyes evenly convex, not strongly protuberant<br>and only slightly interrupting longitudinal lateral outline of head, about as long as nar-<br>rowest interocular breadth. Rostrum with basal part between transrostral carina and<br>basal suture almost straight or slightly convex longitudinally, slightly shorter than distance<br>between eyes, with a variable median carina that is usually distinct only near the trans-<br>rostral carina<br> declivitous apical part rather shiny, with small obscure punctures, scales<br>becoming smaller and sparser distally<br> apex, sides, and venter of rostrum, including sides<br>of mandibles, bristling with long erect setae. Antennae with scape slightly longer‘zthan<br>funicle excluding club, densely squamose and with numerous, rather long, white, recurnx<br>bent or subrccurnbent setae, apex only slightly enlarged<br> funiele with short and long setae<br>and without scales, length of segments as follows: (I, 1.8) (2, 1.8) (3, 1.3) (4, 1.2)<br>(5, 1.1) (6, 1.1) (7, 1.0) <br> club about as long as segments 3 plus 4, its ﬁrst segment bear-<br>ing the ratio of 10: 6 to its second, ﬁrst segment as long as funicular segment 7. Prat/zo-<br>mx slightly broader than long (45:41)), broadest at middle, subequally narrowed from<br>middle to base and middle to apex, disk but slightly convex or somewhat depressed<br> punc-<br>tures coarse and deep, somewhat irregular and variable, often making dorsum somewhat<br>irregular, some tending to be longitudinally conﬂuent, interstices variable in breadth,<br>some only as broad as a scale and narrower than punctures, others as broad as punctures,<br>others broader<br> each puncture bearing a recurved, transversely directed seta about as long<br>as its puncture<br> puncturation less coarse and deep on pleurae. Elytru from about two<br>thirds to about three fourths as broad as long, broadest in females, broadest at the postero-<br>lateral corners of the extensions of humeral angulations<br> base truncate or slightly concave,<br>almost straightly and angulately expanded on sides to about basal ﬁfth to form conspicuous<br>pseudodiumeri, thence rather broadly rounded to distal third, thence sharply narrowed to<br>apex, or more or less regularly narrowed from just behind basal angulation<br> disk usually<br>conspicuously irregular, with varifornt undulations and low, rounded, feeble protuberanccs<br>of derm, intervals 5 to 7 usually prominently and irregularly elevated distally<br> intervals<br>each with a row of decumbcnt white setae, ﬁrst intervals usually with a small common<br>fascicle on a line between and slightly before apiees of fourth intervals<br> striae distinct<br>throughout<br> scales usually free and narrowly separated, appressed, reticulate and irides-<br>cent. Legr with femora about as narrow as tibiae at base and about one tenth longer, hind<br>pair reaching to apex of fourth ventrite in female, to middle of ﬁfth in male, strongly<br>clavatc, middle of bulbous part about seven tenths length of femora from base and there<br>about three times as broad as base, densely squamose and with scattered inclined white<br>setae<br> tibiae, excepting a slight distal expansion, subparallel-sided, slightly sinuous, densely<br>squamose and with setae more erect than on femora. Stermmz with scaling almost entirely<br>concealing derm above coxae, somewhat sparser between coxae<br> punctures moderately<br>dense, not very coarse, shortest distance between mid and hind coxae about as long as<br>breadth of a mesocoxa. ther with ﬁrst two ventritcs tumid in female, broadly impressed<br>down middle in male<br> punctures shallow, each giving rise to a rather long, suberect seta<br><br>scaling dense but not entirely concealing derm<br> ventrite 5 about twice as long as 3 plus 4,<br>rather coarsely asperate, closely set with ﬁne setae. Length, 5-8 mm<br> breadth, 3-4 mm."
https://github.com/aubreymoore/insects-of-guam-datamining/raw/master/b172/curculionidae-of-guam/merged_images/Daealus tibialis.jpg,"24. Daealus tibialis, new species (pl. 2, E).<br>Derm reddish brown to black, densely squamose above and below<br> scaling colored as<br>follows: head brown, usually with a white patch at inner upper corner of eye and a dark<br>area on either side of middle of crown<br> prothorax basically with brownish yellow and<br>yellowish white scales, with an outstanding blade vitta behind middle in front of elytral<br>interval 5<br> elytra with basic coloration similar to that of prothorax, with discal area<br>between fasciculate calli on interval 3, laterally to ﬁfth intervals usually quite conspicu—<br>ously paler than surrounding areas, yellowish white, usually with black scales on posterior<br>part of hind callus on interval 3 and a rather large area before and beyond apices of<br>intervals 4 and 7<br> legs with femora banded with pale and dark scales<br> underside yellowish<br>white.<br>Head with derrn almost entirely concealed by sealing which is prostrate or slanting,<br>setae erect and very similar in size and shape to squamae<br> interocular iovea not strongly<br>developed, interocular area coarsely sculptured, with median carina of rostrum continued<br>to level of tops of eyes. Rostrmn about [our ﬁfths as long as pronotum<br> coarsely, con-<br>ﬂuently punctate to antennae in male, lateral carinae irregular or indistinct, median carina<br>Well developed, less coarsely sculptured in female, but closely punctured. Antennae with<br>scape about as long as Inniclc plus basal segment of club<br> funicle with segment 1 about as<br>long as 2 plus one fourth of 3, 2 about as long as 3 plus 4, 3 slightly longer than 4, 4 to 7<br>successively slightly broader<br> club about as long as ﬁve preceding funicular segments.<br>Prnthamx one ﬁfth to one sixth broader than long, rather evenly expanded on sides to near<br>middle, then strongly rounded to subapical constriction at apical fourth, constriction strongly<br>continued across dorsum and making longitudinal dorsal outline conspicuously sinuous<br><br>disk with variable, small to large punctures, median line broadly and conspicuously<br>impressed, with numerous small, low, round, polished tubercles, most numerous on either<br>side of median line, and absent from median canal<br> scaling similar to that on elytra<br> setae<br>scattered, but condensed on either side of middle of apex, erect or suberect, spatulate.<br>Elytm fully three fourths as broad as long, twice as long as prothorax<br> base subtruncate,<br>sides arcnate to middle, thence subtriangularly narrowing to the rounded apex<br> striae with<br>coarse foveiform punctures about as broad as intervals in basal third or half, but small<br>and inconspicuous behind<br> intervals, excepting l and lateral one or two, strongly convex<br>at least in basal half, but not so behind, I not tuberculate, usually with a nearly complete<br>row of suberect, spatulatc setae, 2 with a complete row of tubercles from base to apex,<br>3 with a callus at about basal fourth and another more prominent and higher one at about<br>middle, the calli usually distinctly fasciculate, with tubercles from ﬁrst callus to base,<br>otherwise without tubercles, 4 tubcrculate, 5 partially tuberculate, at least near base, 6 to<br>10 tuberculate, tubercles smaller toward sides and apex of elytra. Legs with Iemora and<br>tibiae densely squamose<br> femora with numerous, scattered tubercles<br> tibiae with two<br>strongly developed carinae on either side. Stcmum densely squamose throughout, meso—<br>sternal receptacle hardly cavernous in either sex<br> metastcrnum between mid and hind<br>coxae one fourth as broad as a mesocoxa Venter densely squamose, with ﬁrst ventrite<br>ﬂattened in middle in male, hardly different in female<br> ventrite 5 with scales mostly<br>replaced by hairs at apex in male. Length, 3—4.0 mm, <br> breadth, l.5~2.0 mini"
https://github.com/aubreymoore/insects-of-guam-datamining/raw/master/b172/curculionidae-of-guam/merged_images/Neoampagia imitator.jpg,"19. Neoampagia imitator, new species (pl. 3, G).<br>Derm reddish brown to pieeous<br> head with brown scales with an interocular pale<br>patch, upper margins of eyes partially margined with pale scales and with a pale patch on<br>either side of the median line on crown<br> pronotum with dark brown scales on disk but with<br>a pale cross consisting of a pale median vitta and a transverse pale fascia at about middle,<br>sides with whitish, yellowish and fawn~colored scales, darker scaling therefore appearing<br>as four discal dark maculae<br> clytra predominantly with dark brown to black scales but<br>with an ill-deﬁned, irregular roughly V»shaped broad area. of fawn~colored scales within<br>basal half from near humeri on sides to suture, pale scaling continued down ﬁrst two or<br>three intervals to posterior calli, pale area there expanded to apex, pale areas tessellated<br>with dark patches and probably subject to considerable variation<br> legs and lower surface<br>clothed with yellowish white or grayish white scales.<br>Head densely punctate on crown, the dorm concealed by the dense appressed scaling<br><br>interocular area one half as broad at top as base of rostrum, coarsely sculptured, scales<br>directed dorsally and becoming narrower and setifortn distad. Rostrum. in male coarsely<br>punctate-striate to antennae on either side of impunctate median line, with small dense<br>punctures beyond antennae. Antennae inserted very slightly past middle in male<br> scape<br>as long as funicle excluding club, gradually clavate<br> funicular segment 1 slightly longer<br>and thicker than 2, 2 slightly longer than 3 plus 4, 3 to 7 each successively more trans~<br>verse<br> club as long as preceding ﬁve funicular segments plus half of sixth, more than half<br>as broad as long, obtusely rounded at apex, 4 segmented, but terminal segment not easily<br>discernible, the two basal segments large and subequal in length. Protharax one third<br>broader than long, apex arcuate, only half as broad as base, arcuately narrowing from<br>base to apical fourth and there rather broadly constricted, constriction broadly, shallowly<br>and distinctly impressed across dorsum<br> densely punctate and very densely squamose<br>throughout, scales ovate, punctures bearing decumbent, lanceolate, squamiform setae<br><br>subcarinate at sides at base in front of humeril Elytm four ﬁfths as broad as long, two<br>and one half times as long as prothorax, almost continuous in outline with base of pro—<br>thorax for a short distance behind humeri on sides, thence arcuately, triangularly narrow-<br>ing to broadly rounded apex, strongly convex dorsally, longitudinally and laterally, reach-<br>ing a summit slightly before middle and there higher than highest point on pronotum,<br>longitudinal outline discontinuous with that of pronotum, scaling very dense, ovate scales<br>imbricated<br> striac shallow and concealed by sealing on disk, but traceable because of their<br>punctures bearing squamitorm, spatulatc setae that usually rise somewhat above scales and<br>are white or usually paler than surrounding scales, stria 7 deeply impressed from humerus<br>to basal third, edge of interval above it therefore forming a distinct carina, 9 similarly<br>impressed and interval above it forming a similar carina, but these carinae variable in<br>development, 10 deeply impressed at base, but ﬁne behind metacoxa<br> intervals, except paru<br>tially elevated ones mentioned, broad and ﬂat. Leg: coarsely punctate and squamose<br> hind<br>femora reaching to slightly behind posterior margin of fourth ventrite<br> tibiae with three<br>lateral carinac on either side and one dorsal carinai Stcmmn densely squamose<br> pectoral<br>canal terminating at middle of mesocoxae<br> metasternum broadly concave, with a fovea on<br>median line at base and apex. Venter with ﬁrst ventrite broadly and‘deeply concave in<br>male<br> ventrites 1 and 2 densely squamose, but scales not entirely concealing derm, min<<br>utely punctatc except for some coarser punctures at base of ﬁrst<br> 2 and 3 squamose at<br>sides and along basal margin only<br> 5 densely and coarsely punctate, setose and squamosc.<br>Length, 3—3.5 mm<br> breadth, 1.6- 0 mm."
https://github.com/aubreymoore/insects-of-guam-datamining/raw/master/b172/curculionidae-of-guam/merged_images/Trigonops hirsuta.jpg,"5. Trigonops hirsuta, new species (pl. 1, D),<br>Dei'm dark reddish brown to black<br> scaling almost uniformly grayish white or with<br>a brownish east, browner in old specimens, scales in fresher specimens giving iridescent<br>reﬂections<br> pronotum normally with a variable, broad vitta from base to apex on either<br>side of median line of slightly to distinctly darker scales<br> elytra either concolot‘ous or<br>appearing vaguely vitmte because of darker, paler or more densely squainose areas on<br>some intervals<br> scaling otherwise almost or quite concolorous.<br>Head with front almost straight in longitudinal dorsal outline, densely squamose, less<br>densely so at sides than mesad, punctures denser and more conspicuous laterally, [bearing<br>prostrate or inclined medially directed setae<br> eyes quite prominent, unevenly convex,<br>roundly subconical, much more steeply rounded behind than distally, about three fourths<br>as long as distance between their inner margins. Rostrum with area between transrostral<br>carina and basal suture ﬂattened longitudinally and distinctly sunken below level of carina,<br>distance between carina and suture three fourths or somewhat more than three fourths as<br>long as interoculav breadth<br> apical declivitous part concave between and above antennae,<br>rather densely squamose at base, bare or with but a few scattered squamae distally, shal-<br>lowly punctate. Antennae with scape as long as funicle plus ﬁrst two segments of club,<br>densely squamose, ﬁnely setose<br> funicular segments as follows in length: (1, L6) (2, 1.0)<br>(3, 0.9) (4-7, 0.7) <br> club rather elongate subcylindrical<br> about as long as funicular segments<br>5-7 inclusive plus three fourths of 4, its ﬁrst segment about one fourth longer than its<br>second. Prol/mrax as long as broad to distinctly broader than long, broadest at or slightly<br>behind middle, dorsal contour gently convex laterally and longitudinally<br> densely punctate,<br>but puncturation obscured by dense scaling which entirely conceals dei‘m of interstices<br>which are as broad or slightly narrower than diameters of punctures on disks<br> sctae<br>medially inclined, arising from lateral dorsal edges of, and extending across punctures.<br>Elytm about three fourths as broad as long, somewhat more than twice as long as the pro-<br>thorax, broadest at or slightly in front of middle, rather evenly ovate in basal two thirds,<br>thence sharply narrowed to apex, evenly convex dorsally<br> striae deep and well deﬁned<br>throughout, their punctures close<br> intervals slightly convex on disk, more strongly so<br>behind and laterally, densely squamose, scales, as on almost all of body, appearing Soft and<br>spongy, their edges somewhat minutely serrate, their surfaces beaded<br> setae erect through<br>out, discal ones curved, but seen as distinctly erect when viewed from side, becoming more<br>numerous and longer caudad<br> usually with a poorly developed sutural fasciclc on declivity.<br>Legs with hind femora reaching to slightly beyond apex of fourth ventrite in female to<br>about middle of ﬁfth in male, base slightly broader than base of hind tibia, broadest part of<br>club about twice as broad as base and two thirds length of femora from base, densely squa-<br>mose, setae slanting or subcrect throughout<br> hind tibia one ninth shorter than fcmora,<br>straight on outer side above distal expansion, densely squamose, setae erect or nearly so,<br>Sim-1mm with prosternum deeply and coarsely punctate, squamose, setac erect, distance<br>between coxal cavity and anterior margin one third that between cavity and hind margin,<br>intercoxal process one fourth to almost one half as broad as a coxa<br> mesosternum almost<br>entirely bare, shiny, just above the coxa, side pieces punctate and densely squamose<br>throughout<br> metasternum between the mid and hind coxae as broad as a mesocoxa,<br>coarsely punctate, punctures denser toward middle, that area, therefore, less densely squa~<br>muse than sides, setae erect and conspicuous. Venter with ﬁrst ventrite continuously,<br>broadly and deeply concave with metastcrnum down middle in male, depressed before and<br>behind middle in female, coarsely and densely punctate, denser on disk, scales becoming<br>smaller and scattered medially, setae long and erect<br> second ventrite not quite so coarsely<br>punctate as ﬁrst, less densely squamose at middle of base<br> third and fourth ventrites punc~<br>tate, setose and densely squamose throughout<br> ﬁfth ventrite densely punctate, squamose<br>and setose. Length, 5-7 mm<br> breadth, 3-4 mm."
