image_url,text
https://github.com/aubreymoore/insects-of-guam-datamining/raw/master/b172/curculionidae-of-guam/merged_images/Daealus tuberosus.jpg,"23. Daealus tuberosus, new species (pl. 2, D).<br>Derm reddish brown to black, usually quite shiny where exposed, densely squamose<br>above and below, scaling entirely or almost white or grayish white in old faded specimens<br>but well colored in fresh examples as follows: head pale brown, prothorax basically<br>yellowish White with a brownish-yellow cloud at basal half at sides of disk and one on<br>either side of median line<br> clytra with a broad sub-V-Shaped fascia of yellowish white<br>scales from sides near or distant from base to suture at about middle, pale scaling con-<br>tinued as a vitta down ﬁrst two intervals to apex, otherwise mostly with brownish yellow<br>scales but with a dark brown or black elongate patch on third interval in front of and<br>behind sub-V—shaped macula, but these dark patches subject to much variation, sometimes<br>front ones wanting and occasionally with more dark scaling toward apex of third interval:<br>scaling on legs and underside rather uniformly yellowish white or brownish yellow.<br>Head with crown densely squamose, derm mostly concealed by sealing, scales erect or<br>suberect, with numerous, spatulate, erect setae scattered throughout that project slightly<br>above scales<br> front with similar vestiture to crown, with a distinct elongate interocular<br>fovea that usually begins above a line drawn between tops of eyes and terminates near<br>middle of eyes where distinct median carina of rostrum begins, interoeular area fully as<br>broad as base of rostrum. Rostrum with ventral edge three fourths as long as pronotum<br>in male, more than three fourths as long in female, antennae inserted slightly beyond<br>apical third in male, at or slightly behind apical third in female, coarsely and deeply sculp-<br>turcd from base almost to antennae, with three coarse. somewhat irregular dorsal carinae,<br>striae between them densely set with erect setac, coarsely sculptured and carinate only<br>within basal half in female. Antennae with scape somewhat longer than funicular segments<br>1-7 plus basal segment of club<br> funicle with two basal segments equal in length or ﬁrst<br>slightly longer, 2 slightly shorter than 3 plus 4, 3 almost as long as 4 plus half of 5<br> 4<br>slightly longer than 5, 5 to 7 each successively slightly broader<br> club as long as segments<br>4 to 7 plus part of three. Prothomx more than three fourths as long as broad, broadest<br>somewhat beyond middle, base subtruncate, strongly convex on sides from base to apical<br>third or beyond and ﬂiere with a distinct, not Very deep, but variable, subapical constric-<br>tion, the constriction continued broadly across dorsum which is strongly convex<br> disk with<br>median line rather deeply and conspicuously impressed and without tubercles, with numer—<br>ous, scattered, rounded, prominent, polished tubercles extending through scaling<br> scales<br>similar to those on elytra, very dense, concealing derm, with numerous erect, spatulate<br>setae scattered throughout. Elytra four ﬁfths or ﬁve sixths as broad as long, base subtrun-<br>cate, broadly arcuate on sides from base to about middle and thence rather rapidly nar-<br>nowcd to the apex, longitudinal dorsal contour convex, reaching a summit at about middle<br>and there hardly higher than highest part of pronotum<br> striae mostly concealed by scaling,<br>much narrower than intervals, their punctures well separated, very small behind basal<br>third and each bearing a decumbent squamit’orm seta<br> intervals prominently convex, some<br>of them Anshaped in cross section, especially 3, 5, and 7, interval 1 with a single row of<br>stout, erect, spatulate setae, sometimes setae beginning at a distance from base, without<br>tubercles, 2 with a complete row of prominent tubercles usually interspersed with spatulate<br>setae, 3 usually distinctly more elevated than 2 from base to behind middle, sometimes<br>more strongly elevated at base and just in front of middle, more elevated areas with denser,<br>erect, spatulatc setae giving a fasciculate appearance, either entirely without tubercles or<br>with few to many at base, 4tubercu1ate, 5 setose, either not tuberculate or with a variable<br>number of tubercles at base, 6-10 tuberculate, tubercles becoming smaller on outer inter-<br>vals. Log: with femora and tibiae densely squamose and Setose<br> tibiae not carinate. Ster-<br>mm» densely squamose throughout<br> mesosternal receptacle obviously open in male, its<br>margins fringed with long hair, hind wall slightly more protuberant in female, narrowly<br>and just perceptibly cavernous and without hair<br> metasternum only one fourth or less as<br>long between mid and bind coxae as breadth of a mesocoxa, squamose only in female, but<br>squamose and with dense long hair in male. V enter with ﬁrst ventrite tumid and squamose<br>in female, depressed and with disk free from scales and there with long, dense, simple or<br>compound erect hair in male<br> ventrites 2 to 5 squamose in female, 2 with some long hair<br>and 5 with depressed disk free from scales and hirsute in male. Length, 4-8.0 mm<br><br>breadth, 2—4.0 mm."
https://github.com/aubreymoore/insects-of-guam-datamining/raw/master/b172/curculionidae-of-guam/merged_images/Phloeophagosoma sulcirostre.jpg,"44. Phloeophagosoma sulcirostre, new species (pl. 5, E).<br>Male: den-m shiny, almost entirely reddish brown excepting black eyes<br> setae minute,<br>inconspicucus‘"
https://github.com/aubreymoore/insects-of-guam-datamining/raw/master/b172/curculionidae-of-guam/merged_images/Trigonops subfasciata.jpg,"4. Trigonops subfaseiata (Boheman) Faust, Stett. Ent. Zeitung 58:236,<br>1897. I<br>Celeuﬂretes :ubfasciatus Boheman, Eugenics Rosa, 126, 1859.<br>Holotype male: derm reddish brown<br> densely clothed with mostly pale. brown scales<br>intermixed with almost white scales, almost concolorous<br> darker scales forming a patch<br>on either side of base of pronotum before elytral intervals 35<br> elytra with a rather vague<br>broad V of paler scales, the apex of which is on the suture above apex of ventrite 2, arms<br>across sixth interval just in front of middle<br> dorsal squamac smooth, shiny and with a<br>rather pearly luster, rounded, convex and appearing hard.<br>Head with dense scaling concealing punctures which give rise to decumbent setae<br>’that extend well beyond margins of punctures<br> eyes conspicuously convex, moderately<br>”prominent, strongly interrupting lateral cephalic outline, little longer than half distance<br>between them Rostrum with area between transrostral Catrina and basal suture Hat longi~<br>tudinally, abruptly and obviously depressed below level of carina, slightly convex laterally,<br>without a median carina, squamose part somewhat more than half as long as interocular<br>breadth<br> apical declivitous part, with exception of a few minute scales near base, bare and<br>shiny, densely and rather coarsely punctate. Anlmmac (left antenna lost from type) with<br>scape longer than funicle plus ﬁrst segment of club<br> funicular segments as follows in<br>length: (l, 1.5) (2, Ill) (3, 0.9) (4, 5, 6 and 7, 0.8), club elongate oval, as long as funic-<br>ular segments 7 plus 6 plus 5 plus half of 4, second segment six tenths as long as basal<br>segment. Fromm-cw slightly longer than broad, broadest slightly behind middle, amuate<br>on sides, somewhat more narrowed anteriorly than posteriorly, slightly, almost impercep—<br>tibly constricted just before apex, disk slightly, gently convex longitudinally, rather<br>densely punctate, the punctures usually separated by interstices about as bread as their<br>diameters, obscured by dense scaling, setae arising from interstices instead of from punc-<br>tures, strongly arcuate, medially inclined. Elytra subovate, three fourths as broad as long,<br>twice as long as prothorax, almost straight in longitudinal dorsal outline in basal halt,<br>base concave rather straightly expanded on sides to basal fourth thence rather evenly arcu—<br>ate to pointed apex<br> striae deep throughout<br> intervals almost ﬂat on disk, obviously convex<br>at sides and apex<br> scaling very dense, closely appresscd<br> setac on disk decumbent, becom~<br>ing erect eaudad, interval one with two rows on declivity. Legs with hind femora reaching<br>beyond base of ﬁfth ventrite, broadest part of club twice as broad as base and about five<br>eighths of length from base, densely squamose, almost all of setac slanting and not strongly<br>decumbent, hind tibiae slightly shorter than femora, densely squamose and bristling with<br>setae. Stemum with intercoxal process of the prostcrnum half as broad as a tore coxa,<br>distance between coxal cavity and fore margin one third that between cavity and bind<br>margin, coarsely punctured, scales coarsely reticulate, numerous<br> mesosternum with area<br>just laterad to coxa bare, but epimera densely squamose, intercoxal process densely<br>squamose<br> metasternum between mid and bind coxae about three fourths as long as<br>breadth of a metaeoxa, closely set with large deep punctures in middle, punctures becoming<br>smaller laterally, each puncture bearing a long slanting seta, densely clothed with coarsely<br>reticulate iridescent scales. chter with ﬁrst ventrite broadly and conspicuously impressed<br>in male, ﬁrst two ventrites coarsely and densely punctate, punctures bearing conspicuous<br>erect setae, densely squamose, but less densely so down middle of ﬁrst ventrite and at<br>middle of base of second<br> ventrites 3 and 4 with a row of coarse setiferous punctures from<br>side to side<br> ventrite 5 densely and coarsely punctate, setose and conspicuously squamose.<br>Length, 6 mm.<br> breadth, 3 mm."
https://github.com/aubreymoore/insects-of-guam-datamining/raw/master/b172/curculionidae-of-guam/merged_images/Deretiosus ficae.jpg,"15. Deretiosus ﬁcae, new species (pl. 3, A).<br>Derm reddish brown to black, almost everywhere concealed by dense scaling<br> scaling<br>dirty gray or muddy colored in old abraded specimens, but as follows in fresh, clean<br>examples: head basically fawn colored, becoming paler dorsally, sometimes with some<br>blaCk spots, with an outstanding basal patch of white scales at top of eye<br> prothorax<br>almost entirely white with setae and fascicles fawn colored, or paler or darker, with<br>discal area from base to median fascicles fawn colored and black or almost 01' enti 1y<br>black, apex sometimes mostly black on either side of median line beyond median fascicles<br><br>elytra mostly fawn colored and white with at least the scutellum, bases of ﬁrst three<br>intervals and third interval to ﬁrst fascicle black, or with ﬁrst three intervals almost<br>entirely black to middle, with a black patch at base of ﬁfth interval, and with black extend-<br>ing over part of fourth and ﬁfth intervals at middle or extending to sides and there<br>irregularly clouded with black, and with variations between these extremes in color, the<br>basal half, or somewhat more than half of the elytra, dark, the apical part distinctly paler<br><br>legs spotted and ringed With fawn and brown on a pale or white background<br> scaling<br>below mostly white, but with last three ventrites mostly dark.<br>Head with scaling on crown spongy and in rosettes, spatulate setae hardly projecting<br>above squamae<br> front ﬂattened or shallowly concave, with large, round, ﬂat, prostrate<br>scales, with a conspicuous cluster of long, stout, erect, spatulatc sctae along basal half of<br>inner margins of eyes. Rostrum at most ﬁnely carinate in male, with one median and two<br>lateral carinae<br> punctate throughout in both sexes. Antennae with ﬁrst funicular segment<br>as long as 2, 2 as long as 3 plus more than half of 4-, 3 hardly longer than 4, 5-7 monili~<br>form and each successively broader<br> club ovate, as long as three preceding funicular<br>segments. Prothomx one quarter broader than long, almost straightly, hardly expanded<br>on sides from base almost to apical third, thence abruptly angulatc, forming nearly a right<br>angle, and deeply constricted, distance across constriction distinctly less than three fourths<br>breadth across dorsum at angulations, apex almost hemispherical beyond lateral ema g1<br><br>nations, median line even and hardly convex longitudinally in basal three fourths<br> Scales<br>large, rounded, ﬂat <br> with a well—developed fascicle on either side of median line, bordering<br>a line drawn between fore edges of lateral angulations, and a Well-developed apical fascicle<br>on either side of median line, the lateral angulations with a few stout setae but not fas-<br>ciculate, with a few scattered, stout, erect setae behind median fascicles, two or three<br>between them and lateral angulations, and scattered ones on apical fourth<br> lateral expan-<br>sions ﬂange-like and quite strongly overhanging sides. Scutellmn quite stroneg pro—<br>tuberant. Elylra ﬁve eighths as broad as long, two and two thirds as long as pt‘othorax<br><br>intervals 1 and 2 each with a row of stout, erect setae arising from small pustules, 3 with<br>a low basal fascicle that reaches its summit and extends to a distance from base equal to<br>that between base of prothorax and fore margin of a median fascicle, and with two small<br>fascicles between this and beginning of pale coloration at about or slightly behind middle,<br>or with interval more or less continuously raised there, otherwise with a row of erect<br>setae arising from pustules, 4 with pustules and setae only, 5 with a basal fasciculate callus<br>similar to but shorter and smaller than that on 3, with a small callus on a line between<br>ﬁrst two calli on 3 and with two or three irregular or fragmented calli behind this, the<br>last at apex of interval, ﬁrst usually quite elongate, but variable, 6 with pustules and setae,<br>7 bearing conspicuous subrectangular humeral callus which is followed by stout sctae<br>bearing pustules, 8 rather strongly elevated above ﬁrst two ventrites, 9 elevated above<br>metasternum. Legs with femoral teeth strong and triangular. Stermmi with metasternal<br>receptacle not overhanging, very steep and terminating at about hind margin of mesocoxae<br>in male, concave and terminating at about half way between mid and hind coxae in female.<br>Venter with setae decumbent on ﬁrst two ventrites, ﬁrst ventrite hardly differing in sexes<br><br>ﬁfth ventrite coarsely punctate, almost or quite bare at apex, broadly convex in male,<br>roundly pointed in female. Length, 5-7 mm,<br> breadth, 2.5-3.5 mm."
https://github.com/aubreymoore/insects-of-guam-datamining/raw/master/b172/curculionidae-of-guam/merged_images/Cylindrotrypetes suffusus.jpg,"29. Cylindrotrypetes suffusus, new species (pl. 4, H ).<br>Den-n usually basically piceous black, coxac, trochantcrs, three apical ventrites, at<br>least part of rostrum, scape and funicle of antennae, and often base of head yellowish<br>brown<br> prothorax either almost entirely black or, more usually, with disk yellowish brawn<br>either at apex, apical half, apical two thirds or entirely from base to apex<br> elytra yellowish<br>brown on disk from base to declivity, black along sides and apex<br> body with only minute<br>sctae.<br>H end with an asperate callus extending upon crown from along inner margin of each<br>eye that gives head appearance of having a transverse, dorsal impression across crown<br>when viewed from side<br> greatest interocular breadth almost twice as broad as an eye in"
https://github.com/aubreymoore/insects-of-guam-datamining/raw/master/b172/curculionidae-of-guam/merged_images/Microcryptorhynchus guamae.jpg,"25. Microcryptorhynchus guamae, new species (pl. 3, E).<br>Derm shiny black when exposed, with antennae and tarsi reddish, covered with a<br>comparatively thin incrustation that gives the derrn a dull appearance before abrasion<br><br>setae mostly conspicuously white, but usually with some dusky setae.<br>Head narrowly exposed from above, densely punctate, surface appearing asperate<br>when denuded, with numerous broad, squamiforrn setae on crown and one or two rows of<br>larger, erect, squamiforrn setae along either side of front extending from rostrum, inner<br>rows usually incomplete or absent, but row adjacent to inner margins of eyes always well<br>developed. Rom-mu with four rows of broad squamiforrn setae and encrusted from base<br>to insertion of antennae, distinctly punetate beyond antennae, three dorsal carinae, except<br>part of median one, usually obscured or concealed in male, female with setae and incrusta<<br>tion at base only, otherwise bare and with broad median carina, which becomes evenly<br>broader from base to antennae, and narrower lateral carina well deﬁned and c0nspicuous,<br>sulci between them distinct. Pmthorux almost one third broader than long (3<br> 25),<br>strongly rounded on sides from base to subapical constriction at apical fourth, constriction<br>continued distinctly across dorsum<br> base Subtruncate, basal squamose, declivitous area<br>quite simple, very coarsely, densely reticulately punctate, rather closely set with large,<br>erect, usually broad spatulate setae throughout. Elytm quite strongly inﬂated and sub-<br>globose, but slightly longer than broad (2,5:225), two and one half times longer than<br>prothorax, evenly and strongly rounded on sides, without a subapical constriction, longi-<br>tudinal dorsal contour strongly convex and rising far above. summit of prouotum, and<br>strongly discontinuous with dorsal contour of prothorax<br> striae coarse, as broad or broader<br>than intervals, punctures very large, coarse and quadrate’<br> intervals convex, each bearing<br>a row of very conspicuous, long, erect, heavy, spatulate or clavate setae. Lays with femora<br>and tibiae with rows of long, erect or slanting, spatulate setae and at least tibiae with<br>more or less matted, dense hair<br> tibial uncus arising from outer apical angle and strongly<br>developed throughout. Stmmm with mesosternal receptacle deep and cavernous, pectoral<br>canal terminating at or in front of middle of mesocoxae in male, but only slightly before<br>metasternum in female, hind wall of receptacle about twice as broad in male as female,<br>usually only slightly protuberant<br> metasternum very coarsely and closely punctate, setose,<br>one half to three fourths as long between mid and hind coxae as breadth of a mesocoxa,<br>metacoxae separated by a distance twice that of length of metastcrnum along median<br>line. Venter with ﬁrst two ventrites coarsely, densely, reticulately punctured, setose,<br>strongly turnid and quite similar in both sexes, intercoxal process arcuate<br> ventrite 5<br>coarsely reticulate, indistinctly punctate, bearing scattered setae. Length, 1.5-1.8 mm<br><br>breadth, 0.8-] .25 mm."
https://github.com/aubreymoore/insects-of-guam-datamining/raw/master/b172/curculionidae-of-guam/merged_images/Trigonops vulgaris.jpg,"9. Trigonops vulgaris, new species (pl. 1, G<br> ﬁg. 1, b).<br>Derm dark reddish brown to black<br> scaling variable, basically brownish gray to<br>grayish brown, often with some dark brown scaling, prothorax usually with lateral scaling<br>paler and olten with a pale median vitta, with at least a patch of dark scales in front of<br>elytral intervals 2 and 3 <br> elytra usually with a broad V-shaped fascia of paler scales.<br>Head with the small punctures almost all concealed by dense scaling, usually with a<br>small bare spot, or short bare vitta adjacent to apex of interocular suture<br> eyes quite<br>strongly protuberant, subhemispherical, abruptly interrupting lateral cephalic outline, obvi<<br>ously shorter than distance between them Rostrum with area between transrostral carina<br>and basal suture normally ﬂat or but slightly longitudinally convex and slightly or dis-<br>tinctly depressed below level of transrostral carina, distance between carina and basal<br>suture obviously shorter than narrowest interocular breadth, with or without a trace of<br>a median carina<br> apical declivitous part ﬁnely to coarsely punctate, squamae scattered<br>except for usual condensation at base. Antennae with scape longer than seven funicular<br>segments, setac usually, but not always, conspicuously slanting away from den-n<br> funicular<br>segments as follows in length: (1, 1.3) (2, 1.2) (3, 0.9) (4, 5, 6, and 7, 0.8) <br> club as long<br>as three preceding funicular segmentsI its ﬁrst segment a third or a fourth longer than<br>second, Prothomx slightly broader than long, broadest at about middle and rather evenly<br>arcuate on sides<br> disk closely set with moderately large punctures, interstices narrower<br>or broader than punctures and densely squamose, setae inserted at outer edges of punc-<br>tures, transversely placed, usually quite closely appressed and extending across their punc-<br>tures. Elytm about three fourths as broad as long, twice as long as prothorax, broadest<br>somewhat before middle, broadly arcuate on sides to about apical third thence strongly<br>narrowed to apex<br> striae well deﬁned throughout, discal punctures often preceded by small<br>tubercles near base<br> intervals ﬂat to slightly convex on disk, densely squamose, scales<br>ﬁnely to rather coarsely reticulate, rounded or angular, ﬂat, closely appressed to derm,<br>disral setae usually quite conspicuous and slanting steeply away from derm, but in some<br>individuals much shorter, decumbent and not conspicuous, normally longer and more erect<br>on declivity, often with a feeble sutural fascicle on declivity. Legs with hind fcmora reach-<br>ing to about middle of ﬁfth ventrite in female and about to apex in male, setae usually<br>slanting away from derm, especially along lower edge of shalt, but often rather closely<br>appressed dorsally<br> hind tibial setae bristling. Stermrm with prosternum one half as long<br>between fore margin and coxal cavity as between cavity and hind margin, intercoxal<br>process one fourth to one third as broad as a tore coxa, coarsely punctate, densely<br>squamose<br> mesostemum with side pieces, excluding bare space adjacent to coxae, densely<br>forests, most of which will probably never cause damage of an economic sort.<br>Some of them might damage rustic construction made from unpceled logs or<br>limbs of forest or introduced trees or shrubs.<br>None of the 16 species of subcortical Cossoninae can be considered of<br>importance to agriculture They feed on dead tissues On the other hand, most<br>all of the species of Rhynchophorinae are of distinct economic importance.<br>Rhabdocnemis obscures is the well—known and widely spread borer of sugar<br>cane C omwpolites .rordidus is a serious tropicopolitan pest of bananas. Poly—<br>tes mellerbm‘gi has a similar distribution and also feeds on bananas. The cos—<br>mopolitan C almzdra oryzac damages rice and corn. Diacolandra. frumemi is a<br>widespread coconut insect.<br>All of the weevils of known economic importance in Guam are widespread,<br>introduced species. None of the endemic species is to be feared, unless there<br>be local outbreaks of Trigonops as defoliators of minor importance."
https://github.com/aubreymoore/insects-of-guam-datamining/raw/master/b172/curculionidae-of-guam/merged_images/Rhabdocnemis obscura.jpg,"4S. Rhabdocnemis obscura (Boisduval) (pl, 7, A<br> misspelled oz’zxcm‘ux on<br>plate).<br>Calaﬂdm 0175mm BoistiM/al, Voy‘ Astrolabe, Rm. 2: 448, 1835,<br>Splzmaphams insulzm's Boheman, Eugenics Resa, Ins, 148, 1859,<br>Sphenaphoms mtdicollis Kirsh, Mus. Dresden, Mitt. 2: 156, 1877.<br>Sphenaphoms promissm Pascoe, Mus. civ. stor‘ Hat. Genova, Amt II,<br>2: 300, 1885.<br>Sphenoplmms tinctumtm Pascoe, Mus. ciV. stor. mat. Geneva, Amt 11, 2:<br>301, 1885.<br>Sphenoplmrux becmrii Pascoe, Mus. civ. star. nat. Geneva, Ann 11, 2:<br>301, 1885.<br>Sphennphorux interruptocaxfalus Schaufuss, Home Soc, Ent. Ross 19:<br>204, 1885‘<br>This is the common sugar—cane pest so widespread in the Paciﬁc. Mr.<br>Swézcy took the following specimens: six, Piti, from sugar cane, Oct. 16.<br>1936<br> four, Agana, from royal palm, Oct. 3<br> and seven, Talofofo, from betel<br>nut palm, June 17."
